[
  {
    "fixture_id": "synthetic_knee_lift_left_positive_001",
    "schema_version": "1.0",
    "source_type": "synthetic",
    "provenance_reference": "hand-authored for MP-007",
    "description": "User's left knee clears the scaled lift threshold.",
    "expected_status": "success",
    "annotator": "MP-007 team",
    "movement": "knee_lift_or_step",
    "requested_side": "left",
    "expected_completed": true,
    "expected_feedback_code": "great",
    "category": "positive",
    "observed_consecutive_samples": 2,
    "landmarks": {
      "left_hip": {
        "x": 0.4,
        "y": 0.5,
        "z": 0,
        "visibility": 0.9
      },
      "right_hip": {
        "x": 0.6,
        "y": 0.5,
        "z": 0,
        "visibility": 0.9
      },
      "left_knee": {
        "x": 0.38,
        "y": 0.57,
        "z": 0,
        "visibility": 0.9
      },
      "left_ankle": {
        "x": 0.36,
        "y": 0.72,
        "z": 0,
        "visibility": 0.9
      },
      "right_ankle": {
        "x": 0.64,
        "y": 0.9,
        "z": 0,
        "visibility": 0.9
      }
    }
  },
  {
    "fixture_id": "synthetic_knee_lift_right_negative_001",
    "schema_version": "1.0",
    "source_type": "synthetic",
    "provenance_reference": "hand-authored for MP-007",
    "description": "User's right knee remains in a neutral standing position.",
    "expected_status": "retry",
    "annotator": "MP-007 team",
    "movement": "knee_lift_or_step",
    "requested_side": "right",
    "expected_completed": false,
    "expected_feedback_code": "lift_knee",
    "category": "negative",
    "observed_consecutive_samples": 2,
    "landmarks": {
      "left_hip": {
        "x": 0.4,
        "y": 0.5,
        "z": 0,
        "visibility": 0.9
      },
      "right_hip": {
        "x": 0.6,
        "y": 0.5,
        "z": 0,
        "visibility": 0.9
      },
      "right_knee": {
        "x": 0.62,
        "y": 0.7,
        "z": 0,
        "visibility": 0.9
      },
      "right_ankle": {
        "x": 0.64,
        "y": 0.9,
        "z": 0,
        "visibility": 0.9
      },
      "left_ankle": {
        "x": 0.36,
        "y": 0.9,
        "z": 0,
        "visibility": 0.9
      }
    }
  },
  {
    "fixture_id": "synthetic_knee_lift_right_borderline_001",
    "schema_version": "1.0",
    "source_type": "synthetic",
    "provenance_reference": "hand-authored for MP-007",
    "description": "User's right knee is just below the scaled lift threshold.",
    "expected_status": "retry",
    "annotator": "MP-007 team",
    "movement": "knee_lift_or_step",
    "requested_side": "right",
    "expected_completed": false,
    "expected_feedback_code": "lift_knee",
    "category": "borderline",
    "observed_consecutive_samples": 2,
    "landmarks": {
      "left_hip": {
        "x": 0.4,
        "y": 0.5,
        "z": 0,
        "visibility": 0.9
      },
      "right_hip": {
        "x": 0.6,
        "y": 0.5,
        "z": 0,
        "visibility": 0.9
      },
      "right_knee": {
        "x": 0.62,
        "y": 0.65,
        "z": 0,
        "visibility": 0.9
      },
      "right_ankle": {
        "x": 0.64,
        "y": 0.78,
        "z": 0,
        "visibility": 0.9
      },
      "left_ankle": {
        "x": 0.36,
        "y": 0.9,
        "z": 0,
        "visibility": 0.9
      }
    }
  },
  {
    "fixture_id": "synthetic_knee_lift_left_low_visibility_001",
    "schema_version": "1.0",
    "source_type": "synthetic",
    "provenance_reference": "hand-authored for MP-007",
    "description": "User's left knee has low visibility.",
    "expected_status": "low_visibility",
    "annotator": "MP-007 team",
    "movement": "knee_lift_or_step",
    "requested_side": "left",
    "expected_completed": false,
    "expected_feedback_code": "full_body_missing",
    "category": "low_visibility",
    "observed_consecutive_samples": 0,
    "landmarks": {
      "left_hip": {
        "x": 0.4,
        "y": 0.5,
        "z": 0,
        "visibility": 0.9
      },
      "right_hip": {
        "x": 0.6,
        "y": 0.5,
        "z": 0,
        "visibility": 0.9
      },
      "left_knee": {
        "x": 0.38,
        "y": 0.57,
        "z": 0,
        "visibility": 0.2
      },
      "left_ankle": {
        "x": 0.36,
        "y": 0.72,
        "z": 0,
        "visibility": 0.9
      },
      "right_ankle": {
        "x": 0.64,
        "y": 0.9,
        "z": 0,
        "visibility": 0.9
      }
    }
  }
]
