[
  {
    "fixture_id": "synthetic_side_reach_left_positive_001",
    "schema_version": "1.0",
    "source_type": "synthetic",
    "provenance_reference": "hand-authored for MP-007",
    "description": "User's left wrist reaches outward by at least one shoulder width.",
    "expected_status": "success",
    "annotator": "MP-007 team",
    "movement": "side_reach",
    "requested_side": "left",
    "expected_completed": true,
    "expected_feedback_code": "great",
    "category": "positive",
    "observed_consecutive_samples": 2,
    "landmarks": {
      "left_shoulder": {
        "x": 0.35,
        "y": 0.4,
        "z": 0,
        "visibility": 0.9
      },
      "right_shoulder": {
        "x": 0.65,
        "y": 0.4,
        "z": 0,
        "visibility": 0.9
      },
      "left_elbow": {
        "x": 0.15,
        "y": 0.4,
        "z": 0,
        "visibility": 0.9
      },
      "left_wrist": {
        "x": 0.04,
        "y": 0.4,
        "z": 0,
        "visibility": 0.9
      },
      "right_elbow": {
        "x": 0.62,
        "y": 0.5,
        "z": 0,
        "visibility": 0.9
      },
      "right_wrist": {
        "x": 0.64,
        "y": 0.7,
        "z": 0,
        "visibility": 0.9
      },
      "left_hip": {
        "x": 0.4,
        "y": 0.65,
        "z": 0,
        "visibility": 0.9
      },
      "right_hip": {
        "x": 0.6,
        "y": 0.65,
        "z": 0,
        "visibility": 0.9
      }
    }
  },
  {
    "fixture_id": "synthetic_side_reach_right_negative_001",
    "schema_version": "1.0",
    "source_type": "synthetic",
    "provenance_reference": "hand-authored for MP-007",
    "description": "Requested right arm remains down while the other arm reaches.",
    "expected_status": "retry",
    "annotator": "MP-007 team",
    "movement": "side_reach",
    "requested_side": "right",
    "expected_completed": false,
    "expected_feedback_code": "reach_right",
    "category": "negative",
    "observed_consecutive_samples": 2,
    "landmarks": {
      "left_shoulder": {
        "x": 0.35,
        "y": 0.4,
        "z": 0,
        "visibility": 0.9
      },
      "right_shoulder": {
        "x": 0.65,
        "y": 0.4,
        "z": 0,
        "visibility": 0.9
      },
      "left_elbow": {
        "x": 0.15,
        "y": 0.4,
        "z": 0,
        "visibility": 0.9
      },
      "left_wrist": {
        "x": 0.04,
        "y": 0.4,
        "z": 0,
        "visibility": 0.9
      },
      "right_elbow": {
        "x": 0.65,
        "y": 0.5,
        "z": 0,
        "visibility": 0.9
      },
      "right_wrist": {
        "x": 0.7,
        "y": 0.6,
        "z": 0,
        "visibility": 0.9
      },
      "left_hip": {
        "x": 0.4,
        "y": 0.65,
        "z": 0,
        "visibility": 0.9
      },
      "right_hip": {
        "x": 0.6,
        "y": 0.65,
        "z": 0,
        "visibility": 0.9
      }
    }
  },
  {
    "fixture_id": "synthetic_side_reach_left_borderline_001",
    "schema_version": "1.0",
    "source_type": "synthetic",
    "provenance_reference": "hand-authored for MP-007",
    "description": "User's left reach is 0.80 shoulder widths, just below 0.85.",
    "expected_status": "retry",
    "annotator": "MP-007 team",
    "movement": "side_reach",
    "requested_side": "left",
    "expected_completed": false,
    "expected_feedback_code": "reach_left",
    "category": "borderline",
    "observed_consecutive_samples": 2,
    "landmarks": {
      "left_shoulder": {
        "x": 0.35,
        "y": 0.4,
        "z": 0,
        "visibility": 0.9
      },
      "right_shoulder": {
        "x": 0.65,
        "y": 0.4,
        "z": 0,
        "visibility": 0.9
      },
      "left_elbow": {
        "x": 0.2,
        "y": 0.4,
        "z": 0,
        "visibility": 0.9
      },
      "left_wrist": {
        "x": 0.11,
        "y": 0.4,
        "z": 0,
        "visibility": 0.9
      },
      "right_elbow": {
        "x": 0.62,
        "y": 0.5,
        "z": 0,
        "visibility": 0.9
      },
      "right_wrist": {
        "x": 0.64,
        "y": 0.7,
        "z": 0,
        "visibility": 0.9
      },
      "left_hip": {
        "x": 0.4,
        "y": 0.65,
        "z": 0,
        "visibility": 0.9
      },
      "right_hip": {
        "x": 0.6,
        "y": 0.65,
        "z": 0,
        "visibility": 0.9
      }
    }
  },
  {
    "fixture_id": "synthetic_side_reach_right_low_visibility_001",
    "schema_version": "1.0",
    "source_type": "synthetic",
    "provenance_reference": "hand-authored for MP-007",
    "description": "Requested right wrist has low visibility.",
    "expected_status": "low_visibility",
    "annotator": "MP-007 team",
    "movement": "side_reach",
    "requested_side": "right",
    "expected_completed": false,
    "expected_feedback_code": "full_body_missing",
    "category": "low_visibility",
    "observed_consecutive_samples": 0,
    "landmarks": {
      "left_shoulder": {
        "x": 0.35,
        "y": 0.4,
        "z": 0,
        "visibility": 0.9
      },
      "right_shoulder": {
        "x": 0.65,
        "y": 0.4,
        "z": 0,
        "visibility": 0.9
      },
      "right_elbow": {
        "x": 0.65,
        "y": 0.5,
        "z": 0,
        "visibility": 0.9
      },
      "right_wrist": {
        "x": 0.96,
        "y": 0.4,
        "z": 0,
        "visibility": 0.2
      },
      "left_elbow": {
        "x": 0.2,
        "y": 0.5,
        "z": 0,
        "visibility": 0.9
      },
      "left_wrist": {
        "x": 0.25,
        "y": 0.7,
        "z": 0,
        "visibility": 0.9
      },
      "left_hip": {
        "x": 0.4,
        "y": 0.65,
        "z": 0,
        "visibility": 0.9
      },
      "right_hip": {
        "x": 0.6,
        "y": 0.65,
        "z": 0,
        "visibility": 0.9
      }
    }
  }
]
